[
  {
    "schemaVersion": 2,
    "eventId": "00000000-0000-4000-8000-000000000010",
    "chainId": "00000000-0000-4000-8000-000000000011",
    "segmentStart": true,
    "sequence": 1,
    "timestamp": "2026-10-10T00:00:00Z",
    "previousHash": null,
    "previousSegmentHead": null,
    "recordDigest": "0000000000000000000000000000000000000000000000000000000000000000",
    "traceId": "00000000-0000-4000-8000-000000000012",
    "eventType": "verify",
    "outcome": "passed",
    "toolId": "fixture-synthetic-tool",
    "toolRevision": "aaaaaaaaaaaaaaaaaaaaaaaaaaaaaaaaaaaaaaaa",
    "toolVersion": "1.0.0",
    "projectAlias": "fixture-project",
    "targetId": "macos-arm64-claude-code",
    "adapterId": "fixture-adapter",
    "adapterVersion": "1.0.0",
    "checkId": "fixture-function-check",
    "checkVersion": "1.0.0",
    "verdictSource": "independent-harness",
    "evidenceDigest": "dddddddddddddddddddddddddddddddddddddddddddddddddddddddddddddddd",
    "artifactDigest": "bbbbbbbbbbbbbbbbbbbbbbbbbbbbbbbbbbbbbbbbbbbbbbbbbbbbbbbbbbbbbbbb",
    "actorType": "test-harness",
    "errorCode": null,
    "redaction": { "status": "applied-before-persistence", "policyId": "fixture-redaction", "policyVersion": "1.0.0", "payloadDigest": "eeeeeeeeeeeeeeeeeeeeeeeeeeeeeeeeeeeeeeeeeeeeeeeeeeeeeeeeeeeeeeee" }
  },
  {
    "schemaVersion": 2,
    "eventId": "00000000-0000-4000-8000-000000000013",
    "chainId": "00000000-0000-4000-8000-000000000011",
    "segmentStart": false,
    "sequence": 2,
    "timestamp": "2026-10-10T00:00:01Z",
    "previousHash": "0000000000000000000000000000000000000000000000000000000000000000",
    "recordDigest": "0000000000000000000000000000000000000000000000000000000000000000",
    "traceId": "00000000-0000-4000-8000-000000000012",
    "eventType": "health_check",
    "outcome": "passed",
    "toolId": "fixture-synthetic-tool",
    "toolVersion": "1.0.0",
    "projectAlias": "fixture-project",
    "targetId": "macos-arm64-claude-code",
    "actorType": "manager",
    "errorCode": null,
    "redaction": { "status": "applied-before-persistence", "policyId": "fixture-redaction", "policyVersion": "1.0.0", "payloadDigest": "ffffffffffffffffffffffffffffffffffffffffffffffffffffffffffffffff" }
  }
]
